appid,playtime,developer,genre,description
648800,431,Redbeet Interactive,"Adventure, Indie, Simulation","By yourself or with friends, your mission is to survive an epic oceanic adventure across a perilous sea! Gather debris to survive, expand your raft and set sail towards forgotten and dangerous islands! Trapped on a small raft with nothing but a hook made of old plastic, players awake on a vast, blue ocean totally alone and with no land in sight! With a dry throat and an empty stomach, survival will not be easy! Raft throws you and your friends into an epic adventure out on the big open sea, with the objective to stay alive, gather resources and build yourself a floating home worthy of survival. Resources are tough to come by at sea: Players will have to make sure to catch whatever debris floats by using their trusty hook and when possible, scavenge the reefs beneath the waves and the islands above. However, thirst and hunger is not the only danger in the ocean… watch out for the man- eating shark determined to end your voyage! Find the last parts of civilization still above water. Overcome the challenges therein, uncover the story of its previous inhabitants and find your way to the next destination! Features: ● Multiplayer! Survive by yourself or with friends in online co-op! ● Hook! Use your hook to catch debris floating by. ● Craft! Build survival equipment, weapons, crop plots and more to help you stay alive! ● Build! Expand your raft from a simple wreckage to a buoyant mansion. ● Research! Learn new things to craft in the research table. ● Navigate! Sail your raft towards new destinations and overcome their challenges, uncover their story and find new items to help you on your journey! ● Dive! Drop anchor and explore the depths for more resources. ● Fight! Defend your raft from the dangers of the ocean and fight your way through perilous destinations. ● Farm and cook! Grow crops, catch and tend to animals, cook recipes and make tasty smoothies to keep your stomach happy."
667530,0,Oleg Skutte,"Action, Casual, Free to Play, Indie, Simulation, Sports, Early Access","Support this game / Support this game by buying the DLC and get exclusive items in game About the Game Drunken Wrestlers 2 is a funny multiplayer fighting game based on active ragdoll technology. Physics-Based Combat Drunken Wrestlers 2 is based entirely on physics. The more force you pack into your strikes, the more damage you will deal to your opponent. Characters are subject to external influences and realistically maintain balance thanks to procedural animations. Cross-Platform Online Multiplayer The game allows you to play both online with players on PC and Android, and together on one computer using a controller. The game has a casual and competitive mode. Workshop Maps &amp; Gamemodes The game boasts its own mod editor with C# support, allowing you to create maps and game modes and publish them to the Steam Workshop. Character Customization You are given XP and money for playing, which can be spent on items for character customization. Features: Physics-based fighting mechanics Advanced physically simulated character behaviour Fluid simulation for blood Multiple gamemodes with different gameplay Cross-platform multiplayer Character customization (+Steam Inventory) Ingame mod editor with live scripting support Steam Workshop for gamemodes and maps Replay saving High quality bass music as original soundtrack "
377160,1063,Bethesda Game Studios,RPG,"Creation Kit / Review Highlights About the Game Bethesda Game Studios, the award-winning creators of Fallout 3 and The Elder Scrolls V: Skyrim, welcome you to the world of Fallout 4 – their most ambitious game ever, and the next generation of open-world gaming. As the sole survivor of Vault 111, you enter a world destroyed by nuclear war. Every second is a fight for survival, and every choice is yours. Only you can rebuild and determine the fate of the Wasteland. Welcome home. Key Features: Freedom and Liberty! Do whatever you want in a massive open world with hundreds of locations, characters, and quests. Join multiple factions vying for power or go it alone, the choices are all yours. You’re S.P.E.C.I.A.L! Be whoever you want with the S.P.E.C.I.A.L. character system. From a Power Armored soldier to the charismatic smooth talker, you can choose from hundreds of Perks and develop your own playstyle. Super Deluxe Pixels! An all-new next generation graphics and lighting engine brings to life the world of Fallout like never before. From the blasted forests of the Commonwealth to the ruins of Boston, every location is packed with dynamic detail. Violence and V.A.T.S.! Intense first or third person combat can also be slowed down with the new dynamic Vault-Tec Assisted Targeting System (V.A.T.S) that lets you choose your attacks and enjoy cinematic carnage. Collect and Build! Collect, upgrade, and build thousands of items in the most advanced crafting system ever. Weapons, armor, chemicals, and food are just the beginning - you can even build and manage entire settlements. "
466240,16,World Makers,"Action, Free to Play, Indie","Pre-order Game Master Plushie About the Game Deceit tests your instincts at trust and deception in an action-filled, multiplayer first-person shooter. You wake up in unknown surroundings to the sound of the Game Master’s unfamiliar voice. Surrounded by five others, a third of your group have been infected with the Game Master’s deadly virus and tasked with taking down the other innocent players. Innocents must stay alert, traverse the three zones and escape through the safety hatch as the infected try to pick you off one by one. When playing as an innocent, you’ll progress through the map and come across items to help you survive as you advance towards the exit. However, you will need to decide which of these are most valuable to you, and whether to collaborate or fight with other players to get your hands on them. Every decision gives you more information on your teammates and what side they’re likely to be on. A test of strategy and skill, innocents must work together to gather weapons, secure objectives and vote out those suspected of infection to strengthen their chances of survival. But the environment has been setup to cause conflict amongst the group, creating doubt about the true intentions of players. The infected will be busy collecting blood and trying to cover up their sabotage attempts, whilst the innocents will be keeping an eye out for suspicious behaviour and attempting to make alliances with those they think they can trust. At the end of each zone, a blackout period occurs, allowing the infected players to transform into their terror form and attack. You’ll need this form to kill innocent players. In terror form you’re faster, stronger, and have better vision than your innocent victims and with an array of intense killing animations you’ll be able to create some frightening but also amusing gameplay! Deceit combines the frenzy of fast paced combat mixed with strategic gameplay, and of course the psychological mind games of determining who you can trust."
739630,423,Kinetic Games,"Action, Indie, Early Access","Phasmophobia is a 4 player online co-op psychological horror where you and your team members of paranormal investigators will enter haunted locations filled with paranormal activity and gather as much evidence of the paranormal as you can. You will use your ghost hunting equipment to search for and record evidence of whatever ghost is haunting the location to sell onto a ghost removal team. You can choose to support your team by monitoring the location with CCTV cameras and motion sensors from the safety of the truck or head inside and get your hands dirty with the ghostly activity that will get increasingly hostile as time goes on. Immersive Experience: Realistic graphics and sounds as well as having minimal user interfaces will ensure a totally immersive experience that will keep you on your toes. Cross platform: Phasmophobia supports all players whether they have VR or not so can enjoy the game with your VR and non VR friends. Co-op multiplayer: Play alongside your friends with up to 4 players in this co-op horror where teamwork is key to your success. Unique Ghosts: Over 10 different types of Ghosts all with unique traits meaning each investigation will be different. Investigate: Use well known ghost hunting equipment such as EMF Readers, Spirit Boxes, Thermometers and Night Vision Cameras to find clues and gather as much paranormal evidence as you can. Full Voice Recognition: The Ghosts are listening! Use your actual voice to interact with the Ghosts through Ouija Boards and EVP Sessions using a Spirit Box. "
427460,0,Not Found,Not Found,Description Not Found
504370,200,Stunlock Studios,"Action, Free to Play","Battlerite ​ ​is​ ​a​ ​PvP​ ​arena​ ​brawler​ ​and​ ​the​ ​spiritual​ ​successor​ ​to​ ​the critically​ ​acclaimed​ ​Bloodline Champions.​ ​Experience​ ​the​ ​unique​ ​combination​ of a ​​top​-down​ ​shooter​ ​meeting a ​fast​-paced fighting​ ​game and take ​part​ ​in​ ​highly​ ​competitive,​ ​adrenaline-fueled​ ​2v2​ ​and​ ​3v3​ ​battles.​ ​ Engage​ ​in quick​ ​and​ ​intense​ ​action​ ​as​ ​you​ ​take​ ​control​ ​over​ ​one​ ​of​ many Champions,​ ​each​ ​with unique abilities to master.​ ​Welcome​ ​to​ ​a​ ​world​ ​where​ ​Champions​ ​dedicate​ ​their​ ​lives​ ​to​ ​the Arena. QUICK​ ​ARENA​ ​ACTION ​​​ Master the Arena​ ​in​ explosive​ ​battles​ ​of reaction.​ Choose your Champion, team up with friends, and dive into combat - for glory awaits only those who seek it. PRECISE​ ​GAMEPLAY​ ​MOVEMENT Aim skill-shots and dodge​ ​projectiles​ ​with​ ​the​ ​use​ ​of​ ​WASD​ ​movement​ ​&amp; cursor​-​based​ ​aiming.​ Wield total control over your champion and execute massive attacks against opponents. PERFORM​ ​BATTLERITES ​​​ Gain​ ​strength​ ​and​ ​upgrade your abilities​ ​using​ ​rites.​ Select ​your​ ​rites​ ​to strategically​ ​customize​ ​your​ ​play​ ​style. ACCOUNT​ ​CUSTOMIZATION ​​ Show​ ​off​ ​your​ ​skills​ ​in​ ​style.​ ​From​ ​weapons​ and outfits ​to​ ​victory​ ​stances, there’s​ ​a​ ​huge​ ​variety​ ​of​ ​cosmetic​ ​customizations​ ​to​ ​make​ ​you​ ​stand​ ​out​ ​from​ ​the​ ​crowd. "
755790,456,Aurora Studio,"Action, Free to Play, Massively Multiplayer","About Ring of Elysium After Mt. Dione and Europa Island, a brand new desert map- Vera has been released. Under the invasion of the deadly nuclear storm, survive the competition and make it out alive! Realistic graphics, a diverse selection of traversal and tactical abilities, and the unique helicopter escape, invites you to join an exciting 60-man battle royale experience! 1.Realistic graphics Highly detailed presentation of natural disaster- simulating surreal weather conditions: Sunny, Cloudy, Foggy, Heavy Rain, Thunderstorms... Combined with a fully dynamic global illumination lighting system, creating a truly immersive game world. 2.Various abilities Traversal equipment: Glider, motorbike, grappling hook, BMX... Tactical abilities: Holographic Decoy, Medgun, Biosignal Detector, Stealth Cloak, Deployable Shield, Recon Drone, Vehicle Modification Kit... While players fight their way through the disaster, how best to utilize these abilities often mean the difference between life and death. 3.Unique helicopter escape Unlike the traditional winning condition, your ultimate goal is to board the rescue helicopter, which opens new strategic possibilities in the BR genre. "
359550,8954,Ubisoft Montreal,Action,"Y7 Pass Edition Comparison Deluxe Edition Operator Edition Ultimate Edition Technical Test Server This is the Technical Test Server client for Tom Clancy's Rainbow Six Siege. This platform will be used to test new features in a controlled environment that allows the development team to iterate without impacting the live game. o Please note : - The T.T.S. client is built off of several different builds at various stages of development, and may not represent the overall quality of the game. - Features seen on the T.T.S. might never make it in the final game: various components are still in conceptual stages and might be discarded throughout the development process. Certain ideas that were postponed or cancelled might also be found in the T.T.S. as a result. - You need to own a version of the game (Standard, Gold, Complete or Starter Edition) to unlock this product - The TTS will only function during specific timeframes. About the Game Master the art of destruction and gadgetry in Tom Clancy’s Rainbow Six Siege. Face intense close quarters combat, high lethality, tactical decision making, team play and explosive action within every moment. Experience a new era of fierce firefights and expert strategy born from the rich legacy of past Tom Clancy's Rainbow Six games. Engage in a brand-new style of assault using an unrivaled level of destruction and gadgetry. On defense, coordinate with your team to transform your environments into strongholds. Trap, fortify and create defensive systems to prevent being breached by the enemy. On attack, lead your team through narrow corridors, barricaded doorways and reinforced walls. Combine tactical maps, observation drones, rappelling and more to plan, attack and defuse every situation. Choose from dozens of highly trained, Special Forces operators from around the world. Deploy the latest technology to track enemy movement. Shatter walls to open new lines of fire. Breach ceilings and floors to create new access points. Employ every weapon and gadget from your deadly arsenal to locate, manipulate and destroy your enemies and the environment around them. Experience new strategies and tactics as Rainbow Six Siege evolves over time. Change the rules of Siege with every update that includes new operators, weapons, gadgets and maps. Evolve alongside the ever-changing landscape with your friends and become the most experienced and dangerous operators out there. Compete against others from around the world in ranked match play. Grab your best squad and join the competitive community in weekly tournaments or watch the best professional teams battle it out in the Rainbow Six Siege Pro League."
623990,0,Not Found,Not Found,Description Not Found
804700,0,NOVECT,Adventure,"The House in Fata Morgana: A Requiem for Innocence A young girl, whose blood is claimed to have miraculous healing powers, kneels battered and beaten before the lord of the land. In the village where she was born, she was worshiped as the daughter of God. And now, the lord holds his sword high in the air, moments away from beheading her. 'You're a damned witch wearing a saint's skin!' But before he can swing his blade down, a young man interferes, saving the girl. So begins the first 'happy' chapter of the young girl's life. And so begins the first act of a tragedy that would come to span nearly a millennium."
433850,78,Daybreak Game Company,"Action, Adventure, Free to Play, Massively Multiplayer","Z1 Battle Royale is a Free to Play, fast-paced, action arcade, competitive Battle Royale. Staying true to its 'King of the Kill' roots, the game has been revamped and restored to the classic feel, look, and gameplay everyone fell in love with. Play solo, duos, or fives and be the last ones standing. New management is in town and restoring the game to it's former glory under a new name, Z1 Battle Royale. Since taking over development of the game in September the team here at NantG has worked with a firey passion to bring back the feel that was lost with the Combat Update. Our first major patch since taking over is coming out today March 6th and we couldn't be more excited for you all to get your hands on it. A Few of the Season 3 Changes/Highlights: -Major Overhaul/Restoration of Movement and Animations -Updated/Restored Combat and Gun Mechanics -Restored Vehicle Mechanics -Restored PS3 Era Map, Environment, and Lighting. -New: In Match Missions -New: Fragments/Collection System -New: Seasonal Play and Ranked Playlist -Announcement of New Showdown Tournament -All New Rewards This is a patch you won't want to miss. Visit the Z1BR website and forums for more info!"
439700,0,Daybreak Game Company,Massively Multiplayer,"TEST SERVER Z1 Battle Royale is a Free to Play, fast-paced, action arcade, competitive Battle Royale. Staying true to its 'King of the Kill' roots, the game has been revamped and restored to the classic feel, look, and gameplay everyone fell in love with. Play solo, duos, or fives and be the last ones standing. New management is in town and restoring the game to it's former glory under a new name, Z1 Battle Royale. Since taking over development of the game in September the team here at NantG has worked with a firey passion to bring back the feel that was lost with the Combat Update. Our first major patch since taking over is coming out today March 6th and we couldn't be more excited for you all to get your hands on it. A Few of the Season 3 Changes/Highlights: -Major Overhaul/Restoration of Movement and Animations -Updated/Restored Combat and Gun Mechanics -Restored Vehicle Mechanics -Restored PS3 Era Map, Environment, and Lighting. -New: In Match Missions -New: Fragments/Collection System -New: Seasonal Play and Ranked Playlist -Announcement of New Showdown Tournament -All New Rewards This is a patch you won't want to miss. Visit the Z1BR website and forums for more info!"
823130,10,Landfall,"Action, Free to Play, Indie","Battle Royal like you've never seen it before. Start the match skydiving face-first into a building and end the game by beating your opponents in a guns-blazing game of the floor is lava. Features Up to 60 players (wobblin' around) Squad, duo and solo mode (great for first dates) Physics-based parkour (the wobblier the better) Fun-sized map (for fun-sized people) 90+ weapons (including a shallow pot with a long handle) Catchphrases (Speak freely in this game... Using 3 words) Blessings and curses for those of you who do well (and not so well) Limbo (u not dead yet mate) "
844590,0,Tendershoot,Simulation,"Greetings Enforcer, and thank you for enlisting in the Hypnospace Patrol Department! As the corporatocracy sleeps, outlaws are out there committing terrible transgressions all across our beloved Hypnospace, and these virtual streets aren't going to police themselves! Hypnospace Outlaw is a '90s internet simulator in which you scour Hypnospace 's wide variety of weird and wonderful websites to hunt down wrongdoers, while also keeping an eye on your inbox, avoiding viruses and adware, and downloading a plethora of apps that may or may not be useful. As part of your job as a Hypnospace Enforcer, you'll be watching out for copyright infringement, internet bullying and more, with reports and rewards coming direct from the Hypnospace Patrol Department to your inbox. In your spare time, you can customize your HypnOS desktop however you see fit, with a variety of downloads, wallpapers, screen savers and helper bots to keep you company. So slip on your Hypnospace Headband™, and keep these key directives in mind: Crawl through Cyberspace : Scour the darkest corners of the Web for scumbag users who violate Hypnospace law! Dangers and delights : Download groovy GIFS and MIDI files, but watch out for adware, toolbars and hackers! Treasure hunting : Do your job to earn Hypnocoins, or ignore your inbox and go hunting for hidden pages, downloads and secrets! Relive your childhood : Equip obnoxious screensavers and skins for your desktop, and wiggle your mouse pointer around to make pages load faster! Hypnospace Outlaw has 31 accessibility features including text to speech, one-button play and navigation clarity! Read the full accessibility report here: -us/accessibility/Hypnospace+Outlaw "
728880,1193,Ghost Town Games Ltd.,"Action, Casual, Indie","introducing: epic chef / Epic Chef is a story-driven adventure game flavoured with life-sim farming, and crafting elements, blended together into one delicious dish via an interactive cooking experience - all served with a side of humour and elaborate cast of characters. New DLC Available Available Now! About the Game Overcooked returns with a brand-new helping of chaotic cooking action! Journey back to the Onion Kingdom and assemble your team of chefs in classic couch co-op or online play for up to four players. Hold onto your aprons … it’s time to save the world (again!) Out of the frying pan, into the fire… You’ve saved the world from the Ever Peckish. Now a new threat has arisen and it’s time to get back in the kitchen to stave off the hunger of The Unbread! ONLINE/LOCAL MULTIPLAYER MADNESS You’ll knead to work together (or against each other) to get the highest score in chaotic local and online multiplayer. FEAST YOUR EYES ON THIS Journey across a brand new overworld map by land, sea and air. Get cooking in new themes ranging from sushi restaurants, magic schools, mines and even alien planets! WHET YOUR APPETITE! Travel the land cooking up a range of new recipes that are sure to cater to any tastes, including sushi, cakes, burgers and pizzas. ROMAINE CALM! Travel through teleporters, across moving platforms and save time by throwing ingredients across dynamic kitchens that shift and evolve. Some kitchens even whisk your chefs away to new locations. "
892970,344,Iron Gate AB,"Action, Adventure, Indie, RPG, Early Access","Join our Discord About the Game Valheim is a brutal exploration and survival game for 1-10 players set in a procedurally-generated world inspired by Norse mythology. Craft powerful weapons, construct longhouses, and slay mighty foes to prove yourself to Odin! EXPLORE THE TENTH WORLD Explore a world shrouded in mystery. Discover distinct environments with unique enemies to battle, resources to gather and secrets to uncover! Be a viking, sail the open seas in search of lands unknown, and fight bloodthirsty monsters. BUILD MIGHTY HALLS Raise viking longhouses and build bases that offer reprieve from the dangers ahead. Customise buildings, both inside and out, with a detailed building system. Progress through building tiers to upgrade, expand and defend your base. GATHER, CRAFT AND SURVIVE Struggle to survive as you gather materials and craft weapons, armor, tools, ships, and defenses. Decorate your hearths and sharpen your blades, grow crops and vegetables, prepare food, brew meads and potions, and progress as you defeat more difficult bosses and discover new recipes and blueprints. KEY FEATURES: Massive procedurally-generated world where every biome is immersive and distinct, with unique enemies, resources and crafting recipes to discover. Play alone or with up to 10 players on player-hosted dedicated servers and experience unlimited world creation and enemies that scale in difficulty. Staminabased combat that rewards preparation and skill. Utilize weapon types with unique attacks, different blocking styles, ranged combat, dodges and parries to fight your enemies. Rewarding food system where you cannot starve and are not punished for not eating, instead you gain health, stamina and regeneration buffs depending on what foods you consume. Intuitive crafting where recipes are discovered as you explore the world, and pick up new resources and ingredients. Flexible building system that takes structural integrity and ventilation into account. Build a small shelter or an entire village, make outposts or claim abandoned buildings as your own. Then customize to your liking. Sail boats and ships to reach distant lands and explore the sea that offers riches to claim and monsters to fight. Epic boss fights that will test even the best prepared vikings and offer rewards that help you on your journey. Community-translated languages: In addition to the officially supported languages, Valheim has several community-translated languages. As the name would suggest these are all translated by fans and members of the community, and is an ongoing process. We can't guarantee the quality nor completeness of any specific translation effort. "
